{
  "scanner": "example-scanner",
  "scanned_artifact_digest": "sha256:41f89c83905a2335098d6acf5a8fe9e490ee2b4747229e46349cfdf4e3973c78",
  "evidence_digest": "sha512:00000000000000000000000000000000000000000000000000000000000000000000000000000000000000000000000000000000000000000000000000000000",
  "scan_scope": ["package"],
  "verdict": "clean",
  "scanned_at": "2026-08-25T00:00:00Z",
  "attestation": "publisher-asserted"
}
