{
  "scanner": "example-scanner",
  "scanned_artifact_digest": "sha256:41f89c83905a2335098d6acf5a8fe9e490ee2b4747229e46349cfdf4e3973c78",
  "scan_scope": ["package"],
  "verdict": "inconclusive",
  "inconclusive_reason": "stale_scan",
  "scanned_at": "2026-08-25T00:00:00Z",
  "attestation": "publisher-asserted"
}
